År,Typ av miljömässigt hållbar upphandling,"Antal upphandlingar, Miljötyp, Summa"
2021,Krav på att merparten av de relevanta inköpen ska överensstämma med förordning (EG) nr 834/2007 om ekologisk produktion och märkning av ekologiska produkter,19
2021,"Krav på överensstämmelse med den högsta energieffektivitetsklassen (såsom fastställs i olika rättsakter, t.ex. förordning (EU) nr 626/2011 om luftkonditioneringsapparater)",19
2021,"Krav på överensstämmelse med miljölednings- och miljörevisionsordningen (Emas), som inrättats genom förordning (EG) nr 1221/2009",125
2021,Krav på överensstämmelse med ISO 14024 typ I-miljömärkning,126
2021,"Krav på överensstämmelse med ett annat ISO 14001-miljöledningssystem än miljölednings- och miljörevisionsordningen (Emas), som inrättats genom förordning (EG) nr 1221/2009",380
2021,Annat,1126
